[
  {
    "id": "coastal-drowned-valley",
    "group": "coastal",
    "alsoGroups": [],
    "geometry": "area",
    "biomes": [
      "ocean",
      "meadow"
    ],
    "sizeKm": [
      1,
      12
    ],
    "dungeonCapable": false,
    "glyph": "g-lagoon",
    "rarity": "uncommon",
    "requires": {
      "nearFlag": "SEA"
    },
    "gloss": "A river mouth the sea has walked up, so the water is salt a long way inland.",
    "absentBecause": null
  },
  {
    "id": "sea-cave",
    "group": "coastal",
    "alsoGroups": [
      "karst"
    ],
    "geometry": "point",
    "biomes": [
      "ocean",
      "rock"
    ],
    "sizeKm": [
      0.02,
      0.3
    ],
    "dungeonCapable": true,
    "glyph": "g-cliff",
    "rarity": "uncommon",
    "requires": {
      "nearFlag": "SEA"
    },
    "gloss": "A dark mouth in the cliff foot that the tide fills twice a day and empties again.",
    "absentBecause": null
  },
  {
    "id": "sea-arch",
    "group": "coastal",
    "alsoGroups": [],
    "geometry": "point",
    "biomes": [
      "ocean",
      "rock"
    ],
    "sizeKm": [
      0.02,
      0.2
    ],
    "dungeonCapable": true,
    "glyph": "g-arch",
    "rarity": "rare",
    "requires": {
      "nearFlag": "SEA"
    },
    "gloss": "A rib of rock the waves have holed clean through, still standing on two legs.",
    "absentBecause": null
  },
  {
    "id": "sea-stack",
    "group": "coastal",
    "alsoGroups": [],
    "geometry": "point",
    "biomes": [
      "ocean",
      "rock"
    ],
    "sizeKm": [
      0.01,
      0.15
    ],
    "dungeonCapable": false,
    "glyph": "g-cliff",
    "rarity": "common",
    "requires": {
      "nearFlag": "SEA"
    },
    "gloss": "A pillar left offshore when the arch beside it fell; birds own the top of it.",
    "absentBecause": null
  },
  {
    "id": "blowhole",
    "group": "coastal",
    "alsoGroups": [],
    "geometry": "point",
    "biomes": [
      "ocean",
      "rock"
    ],
    "sizeKm": [
      0.01,
      0.05
    ],
    "dungeonCapable": true,
    "glyph": "g-cliff",
    "rarity": "rare",
    "requires": {
      "nearFlag": "SEA"
    },
    "gloss": "A hole in the cliff top that spits spray and thunder whenever a big swell comes in.",
    "absentBecause": null
  },
  {
    "id": "geo",
    "group": "coastal",
    "alsoGroups": [],
    "geometry": "line",
    "biomes": [
      "ocean",
      "rock"
    ],
    "sizeKm": [
      0.05,
      0.6
    ],
    "dungeonCapable": false,
    "glyph": "g-cliff",
    "rarity": "uncommon",
    "requires": {
      "nearFlag": "SEA"
    },
    "gloss": "A narrow slot cut back into the cliff along a weak seam, loud with water at the far end.",
    "absentBecause": null
  },
  {
    "id": "wave-cut-platform",
    "group": "coastal",
    "alsoGroups": [],
    "geometry": "area",
    "biomes": [
      "ocean",
      "rock"
    ],
    "sizeKm": [
      0.1,
      2
    ],
    "dungeonCapable": false,
    "glyph": "g-cliff",
    "rarity": "common",
    "requires": {
      "nearFlag": "SEA"
    },
    "gloss": "A flat shelf of scoured rock below the cliff, bare at low water and slick with weed.",
    "absentBecause": null
  },
  {
    "id": "marine-terrace",
    "group": "coastal",
    "alsoGroups": [],
    "geometry": "area",
    "biomes": [
      "rock",
      "meadow"
    ],
    "sizeKm": [
      0.5,
      6
    ],
    "dungeonCapable": false,
    "glyph": "g-cliff",
    "rarity": "uncommon",
    "requires": {
      "nearFlag": "SEA"
    },
    "gloss": "An old shoreline stranded above the present one, level enough to build a road on.",
    "absentBecause": null
  },
  {
    "id": "tombolo",
    "group": "coastal",
    "alsoGroups": [
      "island"
    ],
    "geometry": "line",
    "biomes": [
      "ocean",
      "rock"
    ],
    "sizeKm": [
      0.2,
      3
    ],
    "dungeonCapable": false,
    "glyph": "g-spit",
    "rarity": "rare",
    "requires": {
      "nearFlag": "SEA"
    },
    "gloss": "A neck of sand and shingle joining an island to the shore; it drowns on the big tides.",
    "absentBecause": null
  },
  {
    "id": "spit",
    "group": "coastal",
    "alsoGroups": [],
    "geometry": "line",
    "biomes": [
      "ocean",
      "marsh"
    ],
    "sizeKm": [
      0.3,
      6
    ],
    "dungeonCapable": false,
    "glyph": "g-spit",
    "rarity": "common",
    "requires": {
      "nearFlag": "SEA"
    },
    "gloss": "A finger of shingle the drift keeps building out across open water, growing every year.",
    "absentBecause": null
  },
  {
    "id": "baymouth-bar",
    "group": "coastal",
    "alsoGroups": [],
    "geometry": "line",
    "biomes": [
      "ocean",
      "marsh"
    ],
    "sizeKm": [
      0.3,
      4
    ],
    "dungeonCapable": false,
    "glyph": "g-spit",
    "rarity": "uncommon",
    "requires": {
      "nearFlag": "SEA"
    },
    "gloss": "A bank of sand grown right across a bay mouth, shutting the water in behind it.",
    "absentBecause": null
  },
  {
    "id": "barrier-island",
    "group": "coastal",
    "alsoGroups": [],
    "geometry": "area",
    "biomes": [
      "ocean",
      "meadow"
    ],
    "sizeKm": [
      0.5,
      9
    ],
    "dungeonCapable": false,
    "glyph": "g-spit",
    "rarity": "uncommon",
    "requires": {
      "nearFlag": "SEA"
    },
    "gloss": "A low ridge of sand lying offshore, taking the weather so the mainland does not.",
    "absentBecause": null
  },
  {
    "id": "coastal-lagoon",
    "group": "coastal",
    "alsoGroups": [],
    "geometry": "area",
    "biomes": [
      "ocean",
      "marsh"
    ],
    "sizeKm": [
      0.3,
      8
    ],
    "dungeonCapable": false,
    "glyph": "g-lagoon",
    "rarity": "common",
    "requires": {
      "nearFlag": "SEA"
    },
    "gloss": "Shallow brackish water penned behind a bar, calm when the sea outside is not.",
    "absentBecause": null
  },
  {
    "id": "estuary",
    "group": "coastal",
    "alsoGroups": [],
    "geometry": "area",
    "biomes": [
      "ocean",
      "river",
      "marsh"
    ],
    "sizeKm": [
      1,
      14
    ],
    "dungeonCapable": false,
    "glyph": "g-lagoon",
    "rarity": "common",
    "requires": {
      "nearFlag": "SEA"
    },
    "gloss": "Where the river's water and the sea's argue twice a day over the same mudflats.",
    "absentBecause": null
  },
  {
    "id": "cuspate-foreland",
    "group": "coastal",
    "alsoGroups": [],
    "geometry": "area",
    "biomes": [
      "ocean",
      "meadow"
    ],
    "sizeKm": [
      0.5,
      7
    ],
    "dungeonCapable": false,
    "glyph": "g-spit",
    "rarity": "rare",
    "requires": {
      "nearFlag": "SEA"
    },
    "gloss": "A blunt triangle of shingle thrown out from the coast where two drifts meet.",
    "absentBecause": null
  },
  {
    "id": "machair",
    "group": "coastal",
    "alsoGroups": [],
    "geometry": "area",
    "biomes": [
      "meadow",
      "ocean"
    ],
    "sizeKm": [
      0.2,
      3
    ],
    "dungeonCapable": false,
    "glyph": "g-lagoon",
    "rarity": "rare",
    "requires": {
      "nearFlag": "SEA"
    },
    "gloss": "Shell sand blown inland and gone to grass; grazing on top of what was once a beach.",
    "absentBecause": null
  },
  {
    "id": "raised-beach",
    "group": "coastal",
    "alsoGroups": [],
    "geometry": "line",
    "biomes": [
      "rock",
      "meadow"
    ],
    "sizeKm": [
      0.3,
      5
    ],
    "dungeonCapable": false,
    "glyph": "g-cliff",
    "rarity": "uncommon",
    "requires": {
      "nearFlag": "SEA"
    },
    "gloss": "A band of rounded cobbles well above the waterline, from a sea that has since dropped.",
    "absentBecause": null
  },
  {
    "id": "tidal-flat",
    "group": "coastal",
    "alsoGroups": [],
    "geometry": "area",
    "biomes": [
      "ocean",
      "marsh"
    ],
    "sizeKm": [
      0.5,
      10
    ],
    "dungeonCapable": false,
    "glyph": "g-lagoon",
    "rarity": "common",
    "requires": {
      "nearFlag": "SEA"
    },
    "gloss": "Ground that is mud at low water and sea at high, with no clear edge between them.",
    "absentBecause": null
  },
  {
    "id": "headland",
    "group": "coastal",
    "alsoGroups": [],
    "geometry": "area",
    "biomes": [
      "rock",
      "meadow"
    ],
    "sizeKm": [
      0.3,
      6
    ],
    "dungeonCapable": false,
    "glyph": "g-cliff",
    "rarity": "common",
    "requires": {
      "nearFlag": "SEA",
      "slopeMin": 0.04
    },
    "gloss": "A shoulder of cliff shoved out into the water; the coast road goes over it or not at all.",
    "absentBecause": null
  },
  {
    "id": "sea-waterfall",
    "group": "coastal",
    "alsoGroups": [],
    "geometry": "point",
    "biomes": [
      "ocean",
      "rock"
    ],
    "sizeKm": [
      0.02,
      0.3
    ],
    "dungeonCapable": false,
    "glyph": "g-cliff",
    "rarity": "rare",
    "requires": {
      "nearFlag": "SEA",
      "flowAccMin": 40
    },
    "gloss": "A stream that runs off the cliff lip and never reaches a beach, because there is none.",
    "absentBecause": null
  },
  {
    "id": "delta",
    "group": "fluvial",
    "alsoGroups": [
      "coastal"
    ],
    "geometry": "area",
    "biomes": [
      "river",
      "marsh",
      "ocean"
    ],
    "sizeKm": [
      2,
      20
    ],
    "dungeonCapable": false,
    "glyph": "g-delta",
    "rarity": "uncommon",
    "requires": {
      "nearFlag": "RIVER"
    },
    "gloss": "The river gives up and splits, laying its load down in a fan of shifting channels.",
    "absentBecause": null
  },
  {
    "id": "braided-channel",
    "group": "fluvial",
    "alsoGroups": [],
    "geometry": "line",
    "biomes": [
      "river",
      "scree"
    ],
    "sizeKm": [
      1,
      12
    ],
    "dungeonCapable": false,
    "glyph": "g-meander",
    "rarity": "common",
    "requires": {
      "nearFlag": "RIVER"
    },
    "gloss": "A wide bed of gravel bars where the river runs in a dozen shallow threads at once.",